{
  "schemaVersion": 1,
  "libraryId": "00000000-0000-4000-8000-000000000001",
  "entityType": "asset",
  "entityId": "00000000-0000-4000-8000-000000000101",
  "revision": 4,
  "parentRevision": 3,
  "operationId": "00000000-0000-4000-8000-000000000501",
  "deletedAt": "2026-10-06T19:10:00Z",
  "createdAt": "2026-10-06T19:10:00Z"
}
